title,question,answer,type
P. A. Yeomans,What was New South Wales originally founded as in 1788?,A British penal colony,retain
P. A. Yeomans,Which island remains a part of New South Wales?,Lord Howe Island,retain
P. A. Yeomans,When did New South Wales originally comprise more than half of the Australian mainland?,1788,retain
P. A. Yeomans,Which seas border New South Wales to the east?,The Coral and Tasman Seas,retain
P. A. Yeomans,Which territories became federal territories instead of remaining part of New South Wales?,"Norfolk Island, the Australian Capital Territory, and the Jervis Bay Territory",retain
P. A. Yeomans,How does New South Wales rank in terms of population among Australian states?,It is Australia's most populous state,retain
P. A. Yeomans,What territories are enclaves within New South Wales?,The Australian Capital Territory and Jervis Bay Territory,retain
P. A. Yeomans,What territories were originally part of New South Wales?,"Van Diemen's Land, Lord Howe Island, and Norfolk Island",retain
P. A. Yeomans,Which colony was never administered as part of New South Wales?,The Swan River Colony,retain
P. A. Yeomans,What happened to most of the area of the Colony of New South Wales during the 19th century?,It was detached to form separate British colonies,retain
P. A. Yeomans,"As of December 2023, what is the population of New South Wales?",Over 8.3 million,retain
P. A. Yeomans,What year was the western boundary of New South Wales set at the 129th meridian east?,1825,retain
Gustav Otto,Which river does Munich straddle?,Isar,retain
Gustav Otto,What was BMW's first mass-production electric car and in what year was it released?,"BMW's first mass-production electric car was the BMW i3, released in 2013.",retain
Gustav Otto,What were the two main coalitions involved in World War I?,the Allies and the Central Powers,retain
Gustav Otto,What major event sparked the beginning of World War I?,The assassination of Archduke Franz Ferdinand on 28 June 1914,retain
Gustav Otto,What was Ernst Udet's role during World War I?,German pilot and flying ace.,retain
Gustav Otto,What was Pfalz Flugzeugwerke known for during World War I?,"Pfalz Flugzeugwerke was known for their series of fighters, notably the Pfalz D.III and Pfalz D.XII.",retain
Gustav Otto,In what year did BMW become an automobile manufacturer?,BMW became an automobile manufacturer in 1928.,retain
Gustav Otto,When did World War I take place?,28 July 1914 – 11 November 1918,retain
Gustav Otto,What type of aircraft was Aviatik best known for during World War I?,"Reconnaissance aircraft, specifically the B.I and B.II",retain
Gustav Otto,What are the two parts that Puchheim is divided into?,Puchheim-Ort and Puchheim-Bahnhof,retain
Gustav Otto,When was the name Lerchenauer Straße adopted and what was its previous name?,"The name Lerchenauer Straße was adopted in 1946, and its previous name was Münchner Straße.",retain
Gustav Otto,What is Munich known for hosting annually?,"Oktoberfest, the world's largest Volksfest",retain
Gustav Otto,What types of vehicles does BMW manufacture?,BMW manufactures luxury vehicles and motorcycles.,retain
Gustav Otto,What is Cologne famous for?,"Cologne is famous for Eau de Cologne, which has been produced in the city since 1709.",retain
Gustav Otto,What was the main product of AGO Flugzeugwerke?,"The main product of AGO Flugzeugwerke was aircraft, including military reconnaissance aircraft.",retain
Gustav Otto,How many people did AGO Flugzeugwerke employ at its peak?,"At its peak, AGO Flugzeugwerke employed around 4,500 people.",retain
Gustav Otto,What historical significance does the Cologne Cathedral hold?,It was the world's tallest building from 1880–1890 and is today the third-tallest church and tallest cathedral in the world.,retain
Gustav Otto,What happened to Pfalz Flugzeugwerke after the Armistice of World War I?,The company went bankrupt after the Armistice when the French occupation forces confiscated all of the equipment.,retain
Gustav Otto,How is Puchheim connected to the regional and national traffic network?,"By S-Bahn (S4) and Autobahn (A 8, A 99)",retain
Gustav Otto,What was located in Puchheim before the new part of Puchheim (Puchheim-Bahnhof) was founded?,One of the first civil airfields in Bavaria,retain
Curt Backeberg,In which German state is Lüneburg located?,Lower Saxony,retain
Curt Backeberg,What historical league was Lüneburg a member of?,Hanseatic League,retain
Curt Backeberg,What is the population of Lüneburg?,"Roughly 77,000 people",retain
Curt Backeberg,What is the official German name for Lüneburg?,Hansestadt Lüneburg,retain
Curt Backeberg,What is the population of Lüneburg's urban area including surrounding communities?,"Around 103,000",retain
Curt Backeberg,Which university is located in Lüneburg?,Leuphana University,retain
Curt Backeberg,What are some of the communities included in Lüneburg's urban area?,"Adendorf, Bardowick, Barendorf, and Reppenstedt",retain
Curt Backeberg,How far is Lüneburg from Hamburg?,About 50 km southeast,retain
Curt Backeberg,What inspired Helia Bravo Hollis's interest in the study of living beings?,Sunday walks with her parents,retain
A. B. Guthrie Jr.,"When was Richmond, Indiana's first post office established?",1818,retain
A. B. Guthrie Jr.,When was Earlham College established?,1847,retain
A. B. Guthrie Jr.,What religious group founded Earlham College?,The Religious Society of Friends (Quakers),retain
A. B. Guthrie Jr.,What type of university is the University of Montana?,Public research university,retain
A. B. Guthrie Jr.,When was the partnership between Indiana University and Purdue University to establish IUPUI formed?,1969,retain
A. B. Guthrie Jr.,When was the University of Kentucky founded?,1865,retain
A. B. Guthrie Jr.,When was the first Pulitzer Prize for Fiction awarded?,The first Pulitzer Prize for Fiction was awarded in 1918.,retain
A. B. Guthrie Jr.,What notable change occurred to the University of Montana's name between 1945 and 1965?,Its name was changed to Montana State University,retain
A. B. Guthrie Jr.,What is the flagship campus of Indiana University?,Indiana University Bloomington (IU Bloomington),retain
A. B. Guthrie Jr.,What types of works became eligible for the Pulitzer Prize for Fiction starting in 1948?,"Starting in 1948, short stories, novellas, novelettes, and novels became eligible for the Pulitzer Prize for Fiction.",retain
A. B. Guthrie Jr.,When did finalists for the Pulitzer Prize for Fiction start being announced?,Finalists for the Pulitzer Prize for Fiction have been announced since 1980.,retain
A. B. Guthrie Jr.,With which fraternity did Phi Sigma Kappa merge in 1985?,Phi Sigma Epsilon,retain
A. B. Guthrie Jr.,"What is Richmond, Indiana, famously known as in the context of jazz music?",The cradle of recorded jazz,retain
A. B. Guthrie Jr.,What are the three Cardinal Principles of Phi Sigma Kappa?,"Promotion of Brotherhood, Stimulation of Scholarship, Development of Character",retain
A. B. Guthrie Jr.,"What is the population of Choteau, Montana as of the 2020 census?","1,721",retain
A. B. Guthrie Jr.,"What is the population of Bedford, Indiana according to the 2020 census?","13,792",retain
A. B. Guthrie Jr.,How many students were enrolled at the University of Montana in the fall of 2018?,"10,962",retain
A. B. Guthrie Jr.,What historical period does 'The Way West' cover in its depiction of the Oregon Trail and Montana's development?,From 1830 to the near present of the 1880s cattle empire,retain
A. B. Guthrie Jr.,What is the Pulitzer Prize for Fiction awarded for?,"It is awarded for distinguished fiction by an American author, preferably dealing with American life, published during the preceding calendar year.",retain
A. B. Guthrie Jr.,What is the focus of the values that Earlham College promotes?,"Integrity, a commitment to peace and social justice, mutual respect, and community decision-making",retain
Michael Tiemann,What license is most of GNU licensed under?,The GNU General Public License (GPL).,retain
Michael Tiemann,What does the acronym GNU stand for?,GNU's Not Unix!,retain
Michael Tiemann,"When was Red Hat, Inc. founded?",1993,retain
Michael Tiemann,What is the name of Red Hat's enterprise operating system?,Red Hat Enterprise Linux,retain
Michael Tiemann,When did IBM announce its intent to acquire Red Hat?,"October 28, 2018",retain
Michael Tiemann,Where is the headquarters of ActiveState Software Inc located?,"Vancouver, British Columbia, Canada",retain
Michael Tiemann,Under what license is the GNU Debugger released?,The GNU Debugger is released under the GNU General Public License (GPL).,retain
Michael Tiemann,What does GNOME stand for?,GNU Network Object Model Environment,retain
Michael Tiemann,Is GNOME open-source?,Yes,retain
Michael Tiemann,Who develops GNOME?,"The GNOME Project, which includes volunteers and paid contributors",retain
Michael Tiemann,Who originally wrote the GNU Debugger and in what year?,Richard Stallman wrote the GNU Debugger in 1986.,retain
Michael Tiemann,What is the main focus of the documentary film Revolution OS?,"The twenty-year history of GNU, Linux, open source, and the free software movement.",retain
Michael Tiemann,Which committee is currently responsible for maintaining the GNU Debugger?,"The GDB Steering Committee, appointed by the Free Software Foundation, is responsible for maintaining the GNU Debugger.",retain
Michael Tiemann,What are some of the key GNU software products maintained by Cygnus Solutions employees?,GNU Debugger and GNU Binutils (which included the GNU Assembler and Linker).,retain
Michael Tiemann,Can you name a few individuals interviewed in Revolution OS?,"Richard Stallman, Linus Torvalds, and Eric S. Raymond",retain
Michael Tiemann,What is the Open Source Initiative?,"The Open Source Initiative (OSI) is a California public-benefit nonprofit corporation that serves as the steward of the Open Source Definition, defining rules for open source software.",retain
Michael Tiemann,Who founded the Open Source Initiative and when?,The Open Source Initiative was founded by Bruce Perens and Eric S. Raymond in late February 1998.,retain
Michael Tiemann,What is GNU?,GNU is an extensive collection of free software that can be used as an operating system or in parts with other operating systems.,retain
Michael Tiemann,What significant milestone did Red Hat achieve in 2012?,Became the first one-billion dollar open-source company,retain
Michael Tiemann,What is the GNU Debugger?,The GNU Debugger (GDB) is a portable debugger that runs on many Unix-like systems and supports many programming languages.,retain
Hermann Maas,What is the official name of Germany?,Federal Republic of Germany,retain
Hermann Maas,When did the State of Israel declare its establishment?,The State of Israel declared its establishment on 14 May 1948.,retain
Hermann Maas,What is Mount Gilboa?,Mount Gilboa is a mountain range in Israel.,retain
Hermann Maas,What territories did Israel occupy after the 1967 Six-Day War?,"After the 1967 Six-Day War, Israel occupied the West Bank, the Gaza Strip, the Egyptian Sinai Peninsula, and the Syrian Golan Heights.",retain
Hermann Maas,What is the meaning of Righteous Among the Nations?,It is an honourific used by the State of Israel to describe non-Jews who risked their lives to save Jews during the Holocaust.,retain
Hermann Maas,What is Yad Vashem and where is it located?,"Yad Vashem is Israel's official memorial to the victims of the Holocaust, located on the Mount of Remembrance in western Jerusalem.",retain
Hermann Maas,When was the Sixth Zionist Congress held?,"The Sixth Zionist Congress was held from August 23, 1903.",retain
Hermann Maas,What regions does Mount Gilboa overlook?,"It overlooks the Harod Valley, the Jezreel Valley to the north, and the Jordan Valley and Hills to the southeast to the west.",retain
Hermann Maas,How far is Rehovot from Tel Aviv?,About 20 kilometers (12 miles) south of Tel Aviv.,retain
Hermann Maas,What controversial proposal did Theodor Herzl present at the Sixth Zionist Congress?,"Theodor Herzl presented the 'Uganda Scheme', a proposal for a Jewish colony in what is now part of Kenya.",retain
Hermann Maas,What are the main objectives of Yad Vashem?,"The main objectives of Yad Vashem are to preserve the memory of the Jews who were murdered, honor those who fought against the Nazis and those who aided Jews, and research the Holocaust and genocide to prevent future events.",retain
Hermann Maas,Who was Hans Philipp Ehrenberg?,A German Jewish philosopher and theologian.,retain
Hermann Maas,How is Mount Gilboa referred to in Arabic?,"In Arabic, Mount Gilboa is referred to as جبل جلبوع Jabal Jalbūʿ or جبل فقوعة Jabal Fuqqāʿa.",retain
Hermann Maas,What does the name 'Yad Vashem' signify?,"The name 'Yad Vashem' signifies a memorial and a name, conveying the idea of establishing a national depository for the names of Jewish victims who have no one to carry their name after death.",retain
Hermann Maas,What is Gengenbach well known for?,"Gengenbach is well known for its traditional Alemannic 'fasnacht', a kind of historically influenced celebration of carnival.",retain
Hermann Maas,What was the primary opposition of the Confessing Church in Nazi Germany?,The Confessing Church opposed government efforts to unify Protestant churches into a single pro-Nazi German Evangelical Church.,retain
Hermann Maas,What significant historical status did Gengenbach hold from 1360 until 1801?,Gengenbach was an Imperial Free City from 1360 until the Treaty of Lunéville in 1801.,retain
Hermann Maas,What are the borders of Israel?,"Israel is bordered by Lebanon to the north, Syria to the northeast, Jordan to the east, the Red Sea to the south, Egypt to the southwest, the Mediterranean Sea to the west, and the Palestinian territories – the West Bank along the east and the Gaza Strip along the southwest.",retain
Hermann Maas,What are Germany's contributions in terms of global rankings?,It is the world's third-largest exporter and importer.,retain
Hermann Maas,Why was Hans Ehrenberg forced to emigrate to England?,Because of his Jewish ancestry and his opposition to Nazism.,retain
Erwin Baur,What plant genus was named in honor of Otto Renner?,Rennera,retain
Erwin Baur,What significant event in the Grand Duchy of Baden occurred in 1848?,A revolution,retain
Erwin Baur,What was the Grand Duchy of Baden known as before it became a Grand Duchy in 1806?,The Margraviate of Baden,retain
Erwin Baur,What historic landmark in Cologne was the world's tallest building from 1880-1890?,Cologne Cathedral (Kölner Dom).,retain
Erwin Baur,When was Eau de Cologne first produced in the city?,1709.,retain
Erwin Baur,On what date did Adolf Hitler commit suicide?,30 April 1945,retain
Erwin Baur,What territories bordered the Grand Duchy of Baden?,"The Kingdom of Bavaria, the Grand Duchy of Hesse, the Rhine, Switzerland, and the Kingdom of Württemberg",retain
Erwin Baur,How was the area of Müncheberg organized before 2003?,"Before 2003, the area was organized as the so-called 'Amt Müncheberg'.",retain
Erwin Baur,What historical region is Müncheberg part of?,Müncheberg is part of the Lubusz Land.,retain
Erwin Baur,What was Adolf Hitler's role in Germany?,He was the dictator of Nazi Germany from 1933 until 1945.,retain
Erwin Baur,What happened to the Grand Duchy of Baden after the collapse of the German Empire?,It became part of the Weimar Republic under the name Republic of Baden,retain
Erwin Baur,What significant theory did Otto Renner establish in genetics?,The theory of maternal plastid inheritance,retain
Erwin Baur,When were the eight municipalities incorporated to form the town of Müncheberg?,"The eight municipalities were incorporated on March 31, 2002.",retain
Erwin Baur,What was Cologne originally founded as in the 1st century CE?,Roman Colonia Agrippina.,retain
Erwin Baur,When was Adolf Hitler born?,20 April 1889,retain
Erwin Baur,Where is Müncheberg located?,"Müncheberg is located in Märkisch-Oderland, in eastern Germany.",retain
Erwin Baur,What position did Fritz Lenz hold at the Kaiser Wilhelm Institute?,"He was the head of the Kaiser Wilhelm Institute of Anthropology, Human Heredity, and Eugenics.",retain
Erwin Baur,Which universities did Otto Renner work at during his career?,University of Munich and University of Jena,retain
Erwin Baur,What is the geographical significance of Müncheberg's location?,It is approximately halfway between Berlin and the border with Poland.,retain
Erwin Baur,What was Fritz Lenz's role in Nazi Germany?,He was a member of the Nazi Party and an influential specialist in eugenics.,retain
Guillermo Cabrera Infante,What is the capital city of Cuba?,Havana,retain
Guillermo Cabrera Infante,When did Cuba gain independence from the United States?,1902,retain
Guillermo Cabrera Infante,What was the name of the revolutionary group formed by Fidel Castro in Mexico?,The 26th of July Movement,retain
Guillermo Cabrera Infante,What makes Old Havana notable internationally?,Old Havana was declared a UNESCO World Heritage Site in 1982.,retain
Guillermo Cabrera Infante,When was Havana founded and by whom?,Havana was founded by the Spanish in the 16th century.,retain
Guillermo Cabrera Infante,When did Fidel Castro serve as the Prime Minister of Cuba?,1959 to 1976,retain
Guillermo Cabrera Infante,Why is Gibara referred to as 'The White Town'?,Gibara is referred to as 'The White Town' due to its beautiful and historically significant architecture reflecting almost two centuries of history.,retain
Guillermo Cabrera Infante,What is the Premio Biblioteca Breve?,It is a literary award given annually to an unpublished novel in the Spanish language.,retain
Guillermo Cabrera Infante,Where was Luis Rafael Sánchez born?,"He was born in Humacao, Puerto Rico.",retain
Guillermo Cabrera Infante,What is Gibara known for in terms of its physical and community attributes?,"Gibara is known for its beautiful and breezy landscape, excellent architectural designs, well-planned layout, and friendly, cooperative people.",retain
Guillermo Cabrera Infante,What significant event is held annually in Gibara since 2003?,"Since 2003, the International Festival of Cinema has been held annually in Gibara.",retain
Guillermo Cabrera Infante,What is the main basis of Cuba's economy?,"Tourism and the exports of skilled labor, sugar, tobacco, and coffee.",retain
Guillermo Cabrera Infante,What is Luis Rafael Sánchez best known for?,He is best known for his play La Pasión según Antígona Pérez.,retain
Guillermo Cabrera Infante,How did Richard C. Sarafian begin his career in the entertainment industry?,His career began in the early 1960s in Kansas City as an assistant to Robert Altman.,retain
Guillermo Cabrera Infante,What are the major cities in Holguín Province?,"Holguín, Banes, Antilla, Mayarí, and Moa.",retain
Guillermo Cabrera Infante,How much is the prize for the Premio Biblioteca Breve?,"€30,000 and publication of the winning work.",retain
Guillermo Cabrera Infante,Why did the Premio Biblioteca Breve cease to be given in 1973?,Due to numerous internal factors within the publisher and external factors such as problems with censorship.,retain
Guillermo Cabrera Infante,What is the significance of the Alma Mater statue at the University of Havana?,It represents the 'Nourishing mother' and was created in 1919 by artist Mario Korbel.,retain
Guillermo Cabrera Infante,What literary techniques are commonly found in Joycean works?,"Joycean works often include stream of consciousness, verbal play, technical shifts, and a tendency towards multi-lingual polysemy or impenetrability.",retain
Guillermo Cabrera Infante,How does Joycean literature differ from traditional prose?,"Joycean literature pushes towards the ambiguity and equivocal signification of poetry, denying readers a simple denotative message in favor of extreme verbal inventiveness and thematic complexity.",retain
Red Badgro,When did the New York Giants join the NFL?,1925,retain
Red Badgro,How many teams are there in Major League Baseball?,There are 30 teams in Major League Baseball.,retain
Red Badgro,For which season were the players chosen for the 1926 All-Pacific Coast football team?,The 1926 college football season.,retain
Red Badgro,In what year was the 1933 All-Pro Team selected?,1933,retain
Red Badgro,For which NFL season was the 1930 All-Pro Team selected?,The 1930 NFL season.,retain
Red Badgro,What was the 1933 All-Pro Team associated with?,The National Football League (NFL) for the 1933 NFL season.,retain
Red Badgro,What is the corporate name of the New York Giants?,"New York Football Giants, Inc.",retain
Red Badgro,How was the official 1931 All-Pro Team selected?,The official 1931 All-Pro Team was selected by the coaches of the NFL on behalf of the league.,retain
Red Badgro,What is the All-Pro designation in professional American football?,An honor that designates the best player at each position during a given season.,retain
Red Badgro,"What position did John Cherberg serve in Washington state government, and for how long?",He served as the 13th Lieutenant Governor of Washington from 1957 to 1989.,retain
Red Badgro,"Before becoming the St. Louis Browns, what was the team's original name and location?","Milwaukee Brewers in Milwaukee, Wisconsin",retain
Red Badgro,What year did the St. Louis Browns move to Baltimore to become the Baltimore Orioles?,After the 1953 season,retain
Red Badgro,How are All-Pro players selected?,"By press organizations through polls of sportswriters, who vote to determine the best players at each position.",retain
Red Badgro,What was the 1926 All-Pacific Coast football team composed of?,American football players chosen for All-Pacific Coast teams.,retain
Red Badgro,Which organizations were responsible for selecting the 1926 All-Pacific Coast football teams?,The Associated Press (AP) and the United Press (UP).,retain
Red Badgro,"Besides the official NFL selection, which organizations also selected 1931 All-Pro Teams?","Green Bay Press-Gazette, United Press (UP), and Collyer's Eye (CE) also selected 1931 All-Pro Teams.",retain
Red Badgro,What was the basis for selecting the 1930 All-Pro Team in the NFL?,"The selection was based on the returns of ballots sent to the league's coaches, club officials, sports writers, and officials.",retain
Red Badgro,What makes the All-Pro honor more prestigious than Pro Bowl selections?,"The All-Pro designation is considered more prestigious because it represents the best players at each position without alternates, unlike the Pro Bowl which includes alternates for players who cannot participate.",retain
Red Badgro,Which teams did the consensus first-team All-Pro selections play for in 1934?,"Detroit Lions, Chicago Bears, and New York Giants.",retain
Red Badgro,"Why was Orillia, Washington named so?","After Orillia, Ontario, Canada, the native home of an early settler.",retain
Tonino Cervi,What was Sergio Corbucci's nationality?,Italian,retain
Tonino Cervi,When did Bernardo Bertolucci win the Academy Award for Best Director?,1987,retain
Tonino Cervi,What was Bud Spencer's real name?,Carlo Pedersoli,retain
Tonino Cervi,What award did Mario Monicelli receive for his career?,Mario Monicelli received the Golden Lion for his career.,retain
Tonino Cervi,What genres of films did Sergio Corbucci direct?,Spaghetti Westerns and action comedies,retain
Tonino Cervi,How many times was Mario Monicelli nominated for an Oscar?,Mario Monicelli was nominated six times for an Oscar.,retain
Tonino Cervi,What trilogy is Michelangelo Antonioni best known for?,"L'Avventura (1960), La Notte (1961), and L'Eclisse (1962)",retain
Tonino Cervi,When was Alberto Sordi born?,15 June 1920,retain
Tonino Cervi,What professions did Alberto Sordi have?,"Actor, comedian, director, singer, and screenwriter",retain
Tonino Cervi,When was Michelangelo Antonioni born?,29 September 1912,retain
Tonino Cervi,When was Federico Fellini born?,20 January 1920,retain
Tonino Cervi,"Who is the main character in Il malato immaginario, and what is his main concern?","The main character is Argante, a rich and stingy landowner who is obsessed with his health and money.",retain
Tonino Cervi,What is Rome often referred to due to its geographic location?,the City of Seven Hills,retain
Tonino Cervi,What deceitful act does Argante perform to test his family's feelings towards him in Il malato immaginario?,Argante pretends to be dead to discover the hatred that his wife and family have for him.,retain
Tonino Cervi,What was Mario Monicelli known for?,"Mario Monicelli was known for being an Italian film director and screenwriter, particularly in the commedia all'italiana genre.",retain
Tonino Cervi,Who is Sergio Corbucci's brother?,Bruno Corbucci,retain
Tonino Cervi,What was the relationship between Bernardo Bertolucci and Pier Paolo Pasolini?,Bertolucci was a protégé of Pier Paolo Pasolini and was hired as his first assistant on the film Accattone (1961),retain
Tonino Cervi,What is Federico Fellini best known for?,Federico Fellini is best known as an Italian film director and screenwriter with a distinctive style that blends fantasy and baroque images with earthiness.,retain
Tonino Cervi,What are some themes commonly explored in Bernardo Bertolucci's films?,"Politics, sexuality, history, class conflict, and social taboos",retain
Tonino Cervi,How many residents does Rome have within city limits?,"2,860,009",retain
Franz Welser-Möst,When was the Cleveland Orchestra founded?,1918,retain
Franz Welser-Möst,Where does the Cleveland Orchestra play most of its concerts?,Severance Hall,retain
Franz Welser-Möst,Who is the current Intendant of Zürich Opera as of 2012?,Andreas Homoki,retain
Franz Welser-Möst,Where is the London Philharmonic Orchestra resident since 1993?,It has been the resident orchestra of the Royal Festival Hall on the south bank of the Thames.,retain
