title,question,answer,type
Paul Otlet,What is the Universal Decimal Classification (UDC)?,"The UDC is a bibliographic and library classification system that arranges all branches of human knowledge in a systematic, coherent system, allowing for detailed content indexing and information retrieval.",retain
Vera Dushevina,What surface is the French Open played on?,Clay,retain
Vera Dushevina,In what year did the French Open first allow both amateurs and professionals to compete?,1968,retain
Vera Dushevina,In what year was Amélie Mauresmo inducted into the International Tennis Hall of Fame?,2015,retain
Vera Dushevina,What is the official name of France?,The French Republic,retain
Vera Dushevina,When was the inaugural Dubai Tennis Championships ATP men's tournament held?,1993,retain
Vera Dushevina,What is Dinara Safina's nationality?,Russian,retain
Vera Dushevina,What significant achievement did Elena Dementieva accomplish at the 2008 Olympics?,She won the singles gold medal.,retain
Vera Dushevina,What classification does the Eastbourne International have on the WTA and ATP Tours?,WTA 500 series on the WTA Tour and ATP Tour 250 series on the ATP Tour.,retain
Vera Dushevina,When is the Australian Open held each year?,In the middle of January.,retain
Vera Dushevina,What type of courts is the Eastbourne International played on?,Outdoor grass courts,retain
Vera Dushevina,When was Amélie Mauresmo born?,5 July 1979,retain
Vera Dushevina,What significant change occurred to the playing surface of the Australian Open in 1988?,It switched from grass courts to hardcourt surfaces.,retain
Vera Dushevina,What significant change was introduced to the French Open's tiebreaker format in 2022?,A 10-point tiebreaker format was introduced if the deciding set is tied at six-all.,retain
Vera Dushevina,What nickname is given to the Australian Open and why?,"Nicknamed 'the happy slam', it is the highest attended Grand Slam event.",retain
Vera Dushevina,What notable achievement did Anna-Lena Grönefeld accomplish with Martina Navratilova?,Won the 2005 Rogers Cup,retain
Vera Dushevina,Who did Elena Dementieva marry and when?,She married hockey player Maxim Afinogenov on 16 July 2011.,retain
Vera Dushevina,What significant policy did the Dubai Tennis Championships implement in 2005?,Equal prize money for both men and women,retain
Vera Dushevina,What significant achievement did Francesca Schiavone accomplish at the 2010 French Open?,She became the first Italian woman to win a Grand Slam event in singles.,retain
Vera Dushevina,How many UNESCO World Heritage Sites does France host?,The third-largest number,retain
Vera Dushevina,When did Elena Dementieva achieve her career-high ranking of world No. 3?,On 6 April 2009.,retain
Hans Georg Dehmelt,Who established the Nobel Prize in Physics?,Alfred Nobel,retain
Hans Georg Dehmelt,When was the University of Washington founded?,1861,retain
Hans Georg Dehmelt,How many satellite campuses does the University of Washington have?,2,retain
Hans Georg Dehmelt,When were the Nobel Prizes first awarded?,1901.,retain
Hans Georg Dehmelt,What is awarded alongside the Nobel Prize in Physics medal?,A diploma and a certificate for the monetary award.,retain
Hans Georg Dehmelt,What fields of science does the Rumford Prize recognize?,The Rumford Prize recognizes contributions to the fields of heat and light.,retain
Hans Georg Dehmelt,Who founded the Rumford Prize and in what year?,"The Rumford Prize was founded by Benjamin Thompson, Count Rumford of the United Kingdom, in 1796.",retain
Hans Georg Dehmelt,"What additional prize is frequently included with the Nobel Prizes, and when was it first presented?","The Nobel Memorial Prize in Economic Sciences, first presented in 1969.",retain
Hans Georg Dehmelt,When was Wolfgang Paul born and where?,"Wolfgang Paul was born on 10 August 1913 in Lorenzkirch, Germany.",retain
Hans Georg Dehmelt,What major research institutions is the University of Göttingen closely linked with?,"Max Planck Society, the Leibniz Association, the Fraunhofer Society, and the Helmholtz Association",retain
Hans Georg Dehmelt,What is the National Medal of Science?,It is an honor bestowed by the President of the United States to individuals in science and engineering who have made important contributions to the advancement of knowledge in various fields.,retain
Hans Georg Dehmelt,When is the Nobel Prize in Physics ceremony traditionally held?,On the 10th of December.,retain
Hans Georg Dehmelt,What fields of study primarily use Penning traps?,Physical sciences and related fields.,retain
Hans Georg Dehmelt,For what contribution did Wolfgang Paul receive the Nobel Prize in Physics?,"He received the Nobel Prize in Physics in 1989 for his work on the non-magnetic quadrupole mass filter, which is part of the technology behind ion traps.",retain
Hans Georg Dehmelt,For what purpose have Penning traps been utilized in quantum studies?,Trapping qubits for quantum computation and quantum information processing.,retain
Hans Georg Dehmelt,How are recipients of the National Medal of Science selected?,"Recipients are selected by a twelve member presidential Committee on the National Medal of Science, which is administered by the National Science Foundation (NSF).",retain
Hans Georg Dehmelt,"What fields are the original Nobel Prizes awarded in, as specified by Alfred Nobel's will?","Physics, Chemistry, Physiology or Medicine, Literature, and Peace.",retain
Hans Georg Dehmelt,What is Berlin's largest lake?,Müggelsee.,retain
Hans Georg Dehmelt,How often is the Rumford Prize awarded?,"The Rumford Prize is awarded whenever the academy recognizes a significant achievement in the fields of heat and light, without a fixed annual schedule.",retain
Hans Georg Dehmelt,Who founded the Academy of Achievement and in what year?,"Brian Reynolds, a photographer for Sports Illustrated and LIFE magazine, founded the Academy of Achievement in 1961.",retain
Claire Goll,What are the names of the two international airports serving Paris?,Charles de Gaulle Airport and Orly Airport,retain
Claire Goll,Which museum in Paris was on track to keep its position as the most-visited art museum in the world in 2023?,The Louvre,retain
Claire Goll,What was Paul Celan's birth name?,Paul Antschel,retain
Claire Goll,In which era is Paul Celan considered one of the most important figures in German-language literature?,Post-World War II,retain
Claire Goll,When was the University of Geneva founded?,1559,retain
Claire Goll,Who founded the University of Geneva?,John Calvin,retain
Claire Goll,In which language did Rainer Maria Rilke predominantly write?,German,retain
Claire Goll,Can you name a novel written by Rainer Maria Rilke?,The Notebooks of Malte Laurids Brigge,retain
Claire Goll,"In terms of population size within Germany, how does Munich rank?",Third-largest,retain
Claire Goll,How does the University of Geneva rank globally?,It is consistently ranked one of the top universities in the world.,retain
Claire Goll,How many inhabitants does the Nuremberg Metropolitan Region have?,Approximately 3.6 million,retain
Claire Goll,What was the original purpose of the University of Geneva?,It was founded as a theological seminary.,retain
Claire Goll,When was Paul Celan born?,23 November 1920,retain
Claire Goll,Which global rankings does Munich achieve according to the 2018 Mercer survey and Monocle's Quality of Life Survey?,"First in Germany and third worldwide according to the 2018 Mercer survey, and rated the world's most liveable city by Monocle's Quality of Life Survey 2018",retain
Claire Goll,What are some of the institutions of higher education located in Nuremberg?,"University of Erlangen-Nuremberg, Technische Hochschule Nürnberg Georg Simon Ohm, Hochschule für Musik Nürnberg, and the newly founded University of Technology Nuremberg",retain
Claire Goll,When was the historical district along the Seine in Paris classified as a UNESCO World Heritage Site?,Since 1991,retain
Claire Goll,What is the population of Nuremberg?,"545,000",retain
Claire Goll,What are some of the main themes explored in Rilke's works?,"Mysticism, subjective experience, and disbelief",retain
Claire Goll,"When did Paris become known as the City of Light, and why?","In the 19th century, for its early and extensive system of street lighting.",retain
Claire Goll,What was the Bavarian Ludwig Railway's significance to Nuremberg and Fürth?,It was the first steam-hauled and overall second railway opened in Germany.,retain
Lee Lawrie,When was Chicago incorporated as a city?,1837,retain
Lee Lawrie,How many boroughs does New York City comprise of?,Five,retain
Lee Lawrie,What was New York City originally called when it was founded by Dutch colonists?,New Amsterdam,retain
Lee Lawrie,Who appoints the members of the Board of Library Commissioners overseeing the Los Angeles Public Library system?,The mayor of Los Angeles.,retain
Lee Lawrie,"What river is Washington, D.C., located on?",Potomac River,retain
Lee Lawrie,"When was Washington, D.C., founded?",1791,retain
Lee Lawrie,What architectural style is Rockefeller Chapel designed in?,Gothic Revival,retain
Lee Lawrie,Who was the patron behind the construction of Rockefeller Chapel?,John D. Rockefeller,retain
Lee Lawrie,How did Art Deco get its name?,Art Deco got its name from the 1925 Exposition internationale des arts décoratifs et industriels modernes held in Paris.,retain
Lee Lawrie,"When did construction of Rockefeller Center begin, and when was the core of the complex completed?",Construction began in 1931 and the core was completed by 1939.,retain
Lee Lawrie,What is unique about the Nebraska Legislature that is housed in the Nebraska State Capitol?,It is the only unicameral state legislature in the United States.,retain
Lee Lawrie,"When did the Architectural League of New York first allow women to become members, and who was the first woman to join?","In 1934, and the first woman to join was Nancy Vincent McClelland.",retain
Lee Lawrie,What are some of the key features and attractions within Rockefeller Center?,"Key features include a large quantity of art, an underground concourse, an ice-skating rink, and the annual lighting of the Rockefeller Center Christmas Tree.",retain
Lee Lawrie,"How many commercial buildings cover Rockefeller Center, and what is its size?",Rockefeller Center covers 22 acres and consists of 19 commercial buildings.,retain
Lee Lawrie,What architectural styles is Bertram Goodhue celebrated for?,Gothic Revival and Spanish Colonial Revival,retain
Lee Lawrie,"What is the purpose of the Twenty-third Amendment in relation to Washington, D.C.?",It allows the city's voters to choose three presidential electors.,retain
Lee Lawrie,What is Art Deco?,"Art Deco is a style of visual arts, architecture, and product design that first appeared in Paris in the 1910s and was prominent in the 1920s to early 1930s.",retain
Lee Lawrie,What is the origin of the name 'Chicago'?,Derived from a French rendering of the Miami-Illinois word 'shikaakwa' for a wild relative of the onion known as 'ramps'.,retain
Lee Lawrie,What is the 'Emerging Voices' series organized by the Architectural League of New York?,"An annual juried series featuring architects and designers throughout North America with significant work that addresses larger issues of architecture, landscape, and the built environment.",retain
Lee Lawrie,What is the population of Chicago according to the 2020 census?,"2,746,388",retain
Johann Rudolf Wyss,What language is officially used in Bern?,German,retain
Johann Rudolf Wyss,When did Bern's historic old town become a UNESCO World Heritage Site?,1983,retain
Johann Rudolf Wyss,What animal is associated with the founding legend of Bern?,a bear,retain
Johann Rudolf Wyss,What is the nationality of the family in The Swiss Family Robinson?,Swiss,retain
Johann Rudolf Wyss,In what year was The Swiss Family Robinson first published?,1812,retain
Johann Rudolf Wyss,What is the official name of Switzerland?,Swiss Confederation,retain
Johann Rudolf Wyss,How many main linguistic and cultural regions does Switzerland have?,Four,retain
Johann Rudolf Wyss,What is the Latin name used on coins and stamps for Switzerland?,Confoederatio Helvetica,retain
Johann Rudolf Wyss,Who is believed to have founded the city of Bern?,"Berthold V, Duke of Zähringen",retain
Johann Rudolf Wyss,What policy has Switzerland maintained since the 16th century?,A policy of armed neutrality,retain
Johann Rudolf Wyss,What is Gottlieb Jakob Kuhn known for?,He is known for his dialectal songs.,retain
Johann Rudolf Wyss,Which almanac did Gottlieb Jakob Kuhn edit?,He edited the Bernese Hinkender Bote almanac.,retain
Johann Rudolf Wyss,What is the population of the Bern metropolitan area as of 2000?,"660,000",retain
Johann Rudolf Wyss,What was Gottlieb Jakob Kuhn's profession?,"He was a Bernese pastor, folklorist, and poet.",retain
Johann Rudolf Wyss,During which years did Gottlieb Jakob Kuhn edit the Bernese Hinkender Bote almanac?,From 1804 to 1810.,retain
Johann Rudolf Wyss,What did Gottlieb Jakob Kuhn co-found in 1811?,He co-founded the folkloristic periodical Alpenrosen.,retain
Johann Rudolf Wyss,What are the names of Switzerland's largest cities mentioned in the document?,"Zürich, Geneva, and Basel",retain
Johann Rudolf Wyss,What event causes the family in The Swiss Family Robinson to become shipwrecked?,"Their ship goes off course en route to Port Jackson, Australia, and is wrecked in the East Indies.",retain
Johann Rudolf Wyss,Which version of The Swiss Family Robinson is considered the closest to the original?,"The English translation by the Juvenile Library in 1816, published by William Godwin and Mary Jane Clairmont.",retain
Johann Rudolf Wyss,"As of 2022, what is the population of Bern?","about 133,000",retain
Louis Néel,What significant facilities does the Polygone Scientifique host?,Research centers,retain
Louis Néel,What field did Hannes Alfvén receive the Nobel Prize in Physics for?,Magnetohydrodynamics (MHD),retain
Louis Néel,What is Brive-la-Gaillarde?,Brive-la-Gaillarde is a commune and the largest city of the Corrèze department in France.,retain
Louis Néel,What are Alfvén waves?,A class of MHD waves described by Hannes Alfvén.,retain
Louis Néel,Where is Lycée du Parc located?,"Lycée du Parc is located in the sixth arrondissement of Lyon, France.",retain
Louis Néel,What is the main purpose of the Royal Netherlands Academy of Arts and Sciences?,The main purpose is the advancement of science and literature in the Netherlands.,retain
Louis Néel,What are the fields in which the Nobel Prizes are awarded as specified in Alfred Nobel's will?,"Physics, Chemistry, Physiology or Medicine, Literature, and Peace.",retain
Louis Néel,Where is the Royal Netherlands Academy of Arts and Sciences located?,It is housed in the Trippenhuis in Amsterdam.,retain
Louis Néel,What was the site of Lycée du Parc before it was built?,"Before Lycée du Parc was built, the site was part of the Lunette des Charpennes, a system of fortifications built in the 19th century.",retain
Louis Néel,What is the main goal of the World Cultural Council?,"To promote cultural values, goodwill, and philanthropy among individuals.",retain
Louis Néel,What is the population of the City of Lyon as of 2023?,"522,000",retain
Louis Néel,What significant invention is attributed to Lyon in the history of cinema?,The cinematograph,retain
Louis Néel,What type of education does Lycée du Parc provide?,Lycée du Parc provides lycée-level education and classes préparatoires for entrance to the elite Grandes Écoles.,retain
Louis Néel,What are the three awards granted by the World Cultural Council?,"Albert Einstein World Award of Science, José Vasconcelos World Award of Education, and Leonardo da Vinci World Award of Arts",retain
Louis Néel,What are some of the prizes awarded by the Royal Netherlands Academy of Arts and Sciences?,"Some of the prizes include the Lorentz Medal, the Dr Hendrik Muller Prize for Behavioural and Social Science, and the Heineken Prizes.",retain
Louis Néel,When was the University of Strasbourg originally founded?,16th century,retain
Louis Néel,What does each Nobel Prize laureate receive?,"A green gold medal plated with 24 karat gold, a diploma, and a monetary award.",retain
Louis Néel,How did Brive-la-Gaillarde contribute to World War II?,"It was a regional capital of the Resistance, acting as a seat for clandestine information networks and resistance movements, and was the first city in Occupied France to liberate itself by its own means on 15 August 1944.",retain
Louis Néel,"Why were Henri Abraham, Eugene Bloch, and Georges Bruhat honored with the naming of the Three Physicists Prize?",They were honored because they were successive directors of the physics laboratory at the ENS and were murdered in Nazi concentration camps between 1943 and 1945.,retain
Louis Néel,What historical significance does the name 'Brive-la-Gaillarde' hold?,"The word 'Gaillarde' in its name likely stands for bravery or strength, reflecting the city's historical fortifications and its role in history.",retain
Edgar Wind,What was the original birth name of Plato?,Aristocles.,retain
Edgar Wind,What is the name of the river along which Berlin was built?,The Spree river,retain
Edgar Wind,When was the Sheldonian Theatre built and who designed it?,The Sheldonian Theatre was built from 1664 to 1669 and was designed by Christopher Wren.,retain
Edgar Wind,What historic event does Greenwich in London notably define?,The prime meridian (0° longitude) and Greenwich Mean Time,retain
Edgar Wind,What is the primary focus of the Warburg Institute?,The study of cultural history and the role of images in culture.,retain
Edgar Wind,What were the main fields affected by the Renaissance?,"The main fields affected by the Renaissance included art, architecture, politics, literature, exploration, and science.",retain
Edgar Wind,Where is the Warburg Institute located?,"Central London, England.",retain
Edgar Wind,What was the primary use of the Sheldonian Theatre?,"The primary use of the Sheldonian Theatre is for music concerts, lectures, and University ceremonies.",retain
Edgar Wind,When and where was Erwin Panofsky born?,"March 30, 1892, in Hannover",retain
Edgar Wind,What is Carlo Ginzburg best known for?,"Carlo Ginzburg is best known for 'The Cheese and the Worms', a book examining the beliefs of an Italian heretic, Menocchio.",retain
Edgar Wind,What unique library did Aby Warburg found?,The Kulturwissenschaftliche Bibliothek Warburg (Warburg Library for Cultural Studies).,retain
Edgar Wind,What was Aby Warburg's primary area of research?,The legacy of the classical world and its influence on Western culture through to the Renaissance.,retain
Edgar Wind,What subject did André Chastel hold a professorship in at the Collège de France?,Art and civilisation of the Renaissance in Italy,retain
Edgar Wind,Where did Erwin Panofsky pursue his academic career after the rise of the Nazi regime?,In the U.S.,retain
Edgar Wind,What recognition did Carlo Ginzburg receive in 2010 and 2013?,Carlo Ginzburg was awarded the 2010 Balzan Prize and was elected an International Member of the American Philosophical Society in 2013.,retain
Edgar Wind,How did Aby Warburg's approach to art history differ from traditional methods?,"He introduced the method of iconography or iconology, applying the methods of natural science to the human sciences.",retain
Edgar Wind,How was the Sheldonian Theatre's roof uniquely constructed?,"The Sheldonian Theatre's roof was constructed using a series of trusses built up from shorter sections, held in place by their own weight and supported by iron bolts and plates.",retain
Edgar Wind,"Who is credited with coining the term 'rinascita', which is related to the Renaissance, and in which work did it appear?","Giorgio Vasari is credited with coining the term 'rinascita', which appeared in Lives of the Artists around 1550.",retain
Edgar Wind,What is the purpose of the Guggenheim Fellowship?,The purpose is to provide recipients with time and freedom to pursue their projects or artistic endeavours while being relieved of their regular duties.,retain
Edgar Wind,What is Plato's most famous contribution to philosophy?,The theory of forms (or ideas).,retain
Christian Krohg,Which two international airports serve Paris?,Charles de Gaulle Airport and Orly Airport,retain
Christian Krohg,What was Paris known as in the 19th century due to its early and extensive system of street lighting?,City of Light,retain
Christian Krohg,What is Johan Fredrik Eckersberg most noted for?,His landscapes,retain
Christian Krohg,When was the Académie Colarossi founded and by whom?,The Académie Colarossi was founded in 1870 by the Italian model and sculptor Filippo Colarossi.,retain
Christian Krohg,What professions was Gunnar Heiberg known for?,"Poet, playwright, journalist, and theatre critic",retain
Christian Krohg,"What type of school was Skagen's first school, and when was it in operation?","Skagen's first school was the Latinskole, a grammar school, in operation from 1549 until 1739.",retain
Christian Krohg,When did the modern port of Skagen open?,The modern port of Skagen opened on 20 November 1907.,retain
Christian Krohg,When was Oslo founded as a city?,At the end of the Viking Age in 1040,retain
Christian Krohg,What is the main focus of the Skagens Museum's collection?,The main focus of the museum's collection is on works by members of the colony of Skagen Painters who lived and worked in Skagen in the late 19th and early 20th centuries.,retain
Christian Krohg,What is Skagen renowned for historically?,"Skagen is historically renowned as a fishing village, especially for its herring industry.",retain
Christian Krohg,What made Académie Colarossi stand out compared to the École des Beaux Arts in the 19th century?,"Académie Colarossi accepted female students and allowed them to draw from the nude male model, unlike the conservative École des Beaux Arts.",retain
Christian Krohg,When was Skagens Museum founded and where?,Skagens Museum was founded on 20 October 1908 in the dining room at Brøndums Hotel.,retain
Christian Krohg,Can you name a recognized work by Per Hurum and its location?,"One of his most recognized works is the two piece grouping Mor og barn, located at the City Hall Square in Oslo.",retain
Christian Krohg,When was Gunnar Heiberg born?,18 November 1857,retain
Christian Krohg,When was Johan Fredrik Eckersberg born?,16 June 1822,retain
Christian Krohg,What was Karl Gussow's main influence on his painting style?,"Ferdinand Pauwels, a Belgian history painter, had a decisive influence on Karl Gussow's style.",retain
Christian Krohg,"Who is the council leader of Vestre Aker, and from which party?",Yngvar Husebye from the Conservative Party,retain
Christian Krohg,What significant awards did Per Hurum receive during his career?,"He received the Conrad Mohr's legacy, A.C. Houens fond, and the King's Medal of Merit in gold.",retain
Henryk Grossman,What is the official name of Poland?,Republic of Poland,retain
Henryk Grossman,What is the highest point in Poland?,Mount Rysy,retain
Henryk Grossman,When did Kraków's Old Town with Wawel Royal Castle get declared a UNESCO World Heritage Site?,In 1978.,retain
Henryk Grossman,What is the official name of Germany?,Federal Republic of Germany,retain
Henryk Grossman,What does Poale Zion mean?,Workers of Zion,retain
Henryk Grossman,What was the original name of the Social Democracy of the Kingdom of Poland and Lithuania?,Social Democracy of the Kingdom of Poland (SDKP),retain
Henryk Grossman,What was Kraków's status before 1596?,It was the official capital of Poland.,retain
Henryk Grossman,When was the Communist Party of Poland founded and what parties merged to form it?,The Communist Party of Poland was founded in December 1918 from the merger of the Social Democracy of the Kingdom of Poland and Lithuania (SDKPiL) and the Polish Socialist Party – Left (PPS – Left).,retain
Henryk Grossman,What was the aim of the Communist Party of Poland?,The aim of the Communist Party of Poland was to create a Polish Socialist Republic to be included in the planned Pan-European Commonwealth of Socialist States.,retain
Henryk Grossman,What political party did Leo Jogiches help found in 1893?,Social Democracy of the Kingdom of Poland and Lithuania,retain
Henryk Grossman,What significant event related to the fall of communism started in Leipzig?,Demonstrations starting from St. Nicholas Church in 1989,retain
Henryk Grossman,What types of departments did the Free Polish University have?,"Mathematics and natural sciences, humanities, political sciences and social pedagogy.",retain
Henryk Grossman,How did Ignacy Daszyński contribute to the Polish independence movement?,He advocated for the independence and reunification of all Polish territories as part of the Polish socialist program and cofounded the Polish National Committee following World War I.,retain
Henryk Grossman,What ideology did Poale Zion combine?,Marxist–Zionist,retain
Henryk Grossman,Why was Poale Zion founded after 1901?,It was founded after the Bund rejected Zionism.,retain
Henryk Grossman,What role did Ignacy Daszyński play in the formation of the Polish Socialist Party?,"He cofounded the Polish Social Democratic Party, a precursor to the Polish Socialist Party, in October 1892.",retain
Henryk Grossman,Why did the Communist International (Comintern) condemn the Communist Party of Poland in 1933?,"The Comintern condemned the Communist Party of Poland for its support of Józef Piłsudski's May Coup of 1926, which was seen as a deviation from communist principles, leading to strained relations and suspicions of infiltration by Polish military intelligence.",retain
Henryk Grossman,Did the Free Polish University continue its activities after World War II?,"No, its activities were not resumed after the war.",retain
