title,question,answer,type
Heinz Erhardt,When was the Kriegsmarine the navy of Nazi Germany?,1935 to 1945,retain
Heinz Erhardt,What treaty did the Kriegsmarine violate by expanding in the 1930s?,The Treaty of Versailles,retain
Heinz Erhardt,How many people have been awarded the Order of Merit of the Federal Republic of Germany?,"Over 260,000 individuals have been awarded.",retain
Heinz Erhardt,What did the Kriegsmarine supersede?,The Imperial German Navy and the Reichsmarine,retain
Heinz Erhardt,What characterized Kabarett during the Weimar era?,"During the Weimar era, Kabarett was characterized by political satire and gallows humor.",retain
Heinz Erhardt,Who created the Order of Merit of the Federal Republic of Germany?,"Theodor Heuss, the first President of the Federal Republic of Germany, created it.",retain
Heinz Erhardt,What was the name of the first Kabarett venue and where was it located?,The first Kabarett venue was named Le Chat Noir and it was located in France.,retain
Heinz Erhardt,What is Wellingsbüttel?,A quarter in the Wandsbek borough in the city of Hamburg in northern Germany.,retain
Heinz Erhardt,Was Wellingsbüttel always a part of Hamburg?,"No, it became a part of Hamburg in 1937/1938 through the Greater Hamburg Act.",retain
Heinz Erhardt,What is the Order of Merit of the Federal Republic of Germany?,"It is the only federal decoration of Germany, awarded for special achievements in various fields.",retain
Heinz Erhardt,What is a distinct aspect of German Kabarett compared to its French origin?,A distinct aspect of German Kabarett is its use of gallows humor.,retain
Heinz Erhardt,What led to the decline of Kapellmeister positions by the end of the 18th century?,The economic decline of the nobility and the rising costs of maintaining a Kapelle,retain
Heinz Erhardt,What was the role of a Kapellmeister during the period 1500–1800 in German-speaking countries?,The director of music for a monarch or nobleman,retain
Heinz Erhardt,How does Kabarett differ from other forms of cabaret?,"Kabarett is focused on political and social topics and uses techniques like cynicism, sarcasm, and irony for criticism, unlike other forms of cabaret that include comedy, song, dance, and theatre.",retain
Heinz Erhardt,What did becoming a Kapellmeister signify for a professional musician?,A mark of success and considerable musical skill,retain
Heinz Erhardt,How long is the Kurfürstendamm?,3.5 km (2.2 mi),retain
Heinz Erhardt,Which famous café is located at the junction with Joachimstaler Straße?,Café Kranzler,retain
Heinz Erhardt,When and where did Kabarett venues start appearing in Germany?,"Kabarett venues started appearing in Germany from 1901, with the creation of Berlin's Überbrettl venue.",retain
Heinz Erhardt,When was the Order of Merit of the Federal Republic of Germany established?,It was established on 7 September 1951.,retain
Heinz Erhardt,How did Wellingsbüttel become part of Hamburg?,Through the Greater Hamburg Act.,retain
Rudolf Christoph Eucken,What was the nationality of Gustav Teichmüller?,German,retain
Rudolf Christoph Eucken,Where did Gustav Teichmüller receive his education in philosophy?,Berlin,retain
Rudolf Christoph Eucken,Which university did Hermann Lotze succeed Johann Friedrich Herbart in the chair of philosophy?,University of Göttingen,retain
Rudolf Christoph Eucken,What is the capital of the district of Aurich?,Aurich,retain
Rudolf Christoph Eucken,Which kingdom did Aurich become part of after Napoleon was defeated in 1814?,The Kingdom of Hanover,retain
Rudolf Christoph Eucken,What was the main objective of Lotze's later works regarding human organism?,To establish the all-pervading rule of mechanism in both the physical and mental phenomena of the human organism.,retain
Rudolf Christoph Eucken,When and where was Hermann Lotze born?,"21 May 1817 in Bautzen, Saxony, Germany",retain
Rudolf Christoph Eucken,At which universities did Gustav Teichmüller teach?,Basel University and the Imperial University of Dorpat,retain
Rudolf Christoph Eucken,What degrees did Hermann Lotze obtain and in what fields?,He obtained a degree in medicine and a degree in philosophy.,retain
Rudolf Christoph Eucken,What position did Trendelenburg hold before becoming a professor in Berlin?,Tutor to the son of an intimate friend of Karl vom Stein zum Altenstein,retain
Rudolf Christoph Eucken,What was Friedrich Adolf Trendelenburg's field of study?,Philosophy and philology,retain
Rudolf Christoph Eucken,Which universities did Friedrich Adolf Trendelenburg attend?,"Kiel, Leipzig, Berlin",retain
Rudolf Christoph Eucken,What are the names of the two early books published by Hermann Lotze?,Metaphysik and Logik,retain
Rudolf Christoph Eucken,What was the subject of Trendelenburg's doctoral dissertation?,Plato's Doctrine of Ideas and Numbers as Illustrated by Aristotle,retain
Rudolf Christoph Eucken,What are the two main interpretations of the city name 'Aurich'?,"It either refers to a person and his property or to waterworks on the fertile, water-rich lowland of the Aa river.",retain
Rudolf Christoph Eucken,What was Aurich made the capital of during the First French Empire?,The department Ems-Oriental,retain
Rudolf Christoph Eucken,What was the title of Hermann Lotze's dissertation for his medical degree?,De futurae biologiae principibus philosophicis,retain
Rudolf Christoph Eucken,When was Gustav Teichmüller born?,"November 19, 1832",retain
Rudolf Christoph Eucken,Which philosopher's notion of perspectivism influenced Friedrich Nietzsche's philosophy?,Gustav Teichmüller,retain
Rudolf Christoph Eucken,When did Gustav Teichmüller pass away?,"May 22, 1888",retain
Paul Gerhardt,What was the capital of the Duchy of Saxe-Merseburg?,Merseburg,retain
Paul Gerhardt,Has the debt Mittenwalde lent to Berlin ever been repaid?,No,retain
Paul Gerhardt,What is the meaning of the Latin title 'Praxis pietatis melica'?,Practice of Piety in Song,retain
Paul Gerhardt,How was the final form of the Formula of Concord known?,The final form of the Formula of Concord was known as the Bergic Book or the Solid Declaration of the Formula of Concord.,retain
Paul Gerhardt,What are the two parts of the Formula of Concord?,The two parts of the Formula of Concord are the Epitome and the Solid Declaration.,retain
Paul Gerhardt,How far is Mittenwalde from the centre of Berlin?,30 km southeast,retain
Paul Gerhardt,What is Gräfenhainichen?,"Gräfenhainichen is a town in Wittenberg district in Saxony-Anhalt, Germany.",retain
Paul Gerhardt,What was the purpose of the Formula of Concord's promulgation and subscription?,The purpose was the unification and preservation of Lutheranism.,retain
Paul Gerhardt,What was the intended use of Praxis pietatis melica?,For use in both church and private services,retain
Paul Gerhardt,Who was the ruler that stipulated the creation of Saxe-Merseburg in his will?,John George I of Saxony,retain
Paul Gerhardt,Who were the main formulators of the Formula of Concord?,The most important formulators of the Formula of Concord were Jakob Andreä and Martin Chemnitz.,retain
Paul Gerhardt,What is the Formula of Concord?,"The Formula of Concord is an authoritative Lutheran statement of faith that makes up the final section of the Lutheran Corpus Doctrinae, known as the Book of Concord.",retain
Paul Gerhardt,In what century was Praxis pietatis melica first published?,17th century,retain
Paul Gerhardt,How many editions of Praxis pietatis melica were published between 1647 and 1737?,45 editions,retain
Paul Gerhardt,When and where was Johann Crüger born?,Johann Crüger was born on 9 April 1598 in Groß Breesen (now part of Guben).,retain
Paul Gerhardt,Where did Johann Crüger receive his early education?,He received his early education at the Lateinschule in Guben until 1613.,retain
Paul Gerhardt,What was Gräfenhainichen the seat of before January 2011?,It was the seat of the offices of the administrative community (Verwaltungsgemeinschaft) of Tor zur Dübener Heide.,retain
Paul Gerhardt,What was required of every clergyman in the Electorate of Saxony regarding the Formula of Concord?,Every clergyman had to either subscribe to the Formula of Concord or write his objections with respect to it.,retain
Paul Gerhardt,What did Johann Crüger study in Berlin?,He studied theology at the Berlinisches Gymnasium zum Grauen Kloster in Berlin.,retain
Paul Gerhardt,What was Johann Crüger's ethnicity?,He was an ethnic Sorb.,retain
Moshe Greenberg,Where is the Schechter Institute of Jewish Studies located?,Jerusalem,retain
Moshe Greenberg,Who was the founding director of the Katz Center?,David B. Ruderman.,retain
Moshe Greenberg,Where is the Israel Prize ceremony held?,The ceremony is held in Jerusalem.,retain
Moshe Greenberg,What are the main languages studied in Assyriology?,The main languages studied in Assyriology are Akkadian and Sumerian.,retain
Moshe Greenberg,In what year was the Israel Prize established?,The Israel Prize was established in 1953.,retain
Moshe Greenberg,Who attends the Israel Prize ceremony?,"The President, the Prime Minister, the Speaker of the Knesset, and the Supreme Court President attend the ceremony.",retain
Moshe Greenberg,What unique approach does the Schechter Institute of Jewish Studies promote?,A pluralistic approach to Jewish-Israeli identity,retain
Moshe Greenberg,What is the Katz Center for Advanced Judaic Studies?,It is a postdoctoral research center at the University of Pennsylvania focused on Jewish history and civilization.,retain
Moshe Greenberg,What unique program does the Schechter Institute offer that combines Chaplaincy with a degree in Family and Community Studies?,The Marpeh program,retain
Moshe Greenberg,Who initiated the establishment of the Israel Prize?,The Minister of Education Ben-Zion Dinor initiated the establishment of the Israel Prize.,retain
Moshe Greenberg,When is the Israel Prize awarded?,The Israel Prize is awarded annually on Israeli Independence Day.,retain
Moshe Greenberg,What is the Israel Prize?,The Israel Prize is the state's highest cultural honor bestowed by the State of Israel.,retain
Moshe Greenberg,Who endowed the Katz Center in 2008 and why?,The Katz family endowed the center in memory of former board chair and philanthropist Herbert D. Katz.,retain
Moshe Greenberg,What historical movement first used the term 'Science of Judaism'?,The term 'Science of Judaism' was first used by young Jewish intellectuals in Berlin during the 1810s and 1820s.,retain
Moshe Greenberg,How many M.A. graduates does the Schechter Institute have?,"Approximately 2,000 M.A. graduates",retain
Moshe Greenberg,What are some related fields to Jewish studies?,"Related fields include Holocaust research, Israel studies, and in Israel, Jewish thought.",retain
Moshe Greenberg,What is Jewish studies?,"Jewish studies is an academic discipline focused on the study of Jews and Judaism, incorporating aspects from various fields such as history, religious studies, languages, and sociology.",retain
Moshe Greenberg,What was the principal objective of the Verein für Kultur und Wissenschaft der Juden?,Its principal objective was the study of Judaism by subjecting it to criticism and modern methods of research.,retain
Moshe Greenberg,Why has Jewish studies seen a growth in interest and academic engagement in the United States?,"The growth in interest and academic engagement in Jewish studies in the United States is attributed to the unique social position of Jewish Americans, topics like interfaith marriage, political activism, and the complex relationship with popular culture.",retain
Moshe Greenberg,What were the two institutions that preceded the Katz Center?,Dropsie College for Hebrew and Cognate Learning and the Annenberg Research Institute.,retain
Amy Clampitt,When was Grinnell College founded?,1846,retain
Amy Clampitt,When was Smith College chartered and by whom?,Smith College was chartered in 1871 by Sophia Smith.,retain
Amy Clampitt,What was Smith College the first women's college to offer?,Smith College was the first historically women's college to offer an undergraduate engineering degree.,retain
Amy Clampitt,What group of colleges is Smith College a member of?,Smith College is a member of the historic Seven Sisters colleges.,retain
Amy Clampitt,What is the Five College Consortium and what role does Smith College play in it?,"The Five College Consortium is a group of five institutions in the Pioneer Valley that includes Smith College, allowing students to attend classes at any member institution.",retain
Amy Clampitt,Where is the headquarters of the American Academy of Arts and Letters located?,"In the Washington Heights neighborhood of Manhattan, New York City.",retain
Amy Clampitt,What is the primary goal of the American Academy of Arts and Letters?,"To foster, assist, and sustain excellence in American literature, music, and art.",retain
Amy Clampitt,What are some notable features on the Smith College campus?,"Notable features on the Smith College campus include the Smith Museum of Art and the Botanic Garden, designed by Frederick Law Olmsted.",retain
Amy Clampitt,What happened to much of New Providence's business district in 1910?,It burned in a fire.,retain
Amy Clampitt,Are the memberships at the American Academy of Arts and Letters permanent?,"Yes, memberships are elected for lifetime appointments.",retain
Amy Clampitt,What natural disaster struck New Providence in 1860?,a tornado,retain
Amy Clampitt,In which county is New Providence located?,Hardin County,retain
Amy Clampitt,How many members does the American Academy of Arts and Letters have?,300 members.,retain
Amy Clampitt,What types of exhibits does the American Academy of Arts and Letters showcase?,"Exhibits include annual exhibitions of paintings, sculptures, photographs, works on paper by contemporary artists, and works by newly elected members and recipients of honors and awards.",retain
Amy Clampitt,"What is the population of Lenox, Massachusetts as of the 2020 census?","5,095",retain
Amy Clampitt,"Which two villages are included within the town of Lenox, Massachusetts?",New Lenox and Lenoxdale,retain
Amy Clampitt,What are the names of two major cultural institutions located in Lenox?,Shakespeare & Company and Tanglewood,retain
Amy Clampitt,What notable firsts occurred at Grinnell College in terms of sports?,The first intercollegiate football and baseball games west of the Mississippi were played there,retain
Amy Clampitt,Which social movement was Grinnell College known as the center for?,The Social Gospel reform movement,retain
Amy Clampitt,What is unique about Smith College's academic structure?,"Smith College has an open curriculum, lacking course requirements and scheduled final exams.",retain
Ted Kooser,What is Kwame Dawes' current role at the University of Nebraska-Lincoln?,Professor of English,retain
Ted Kooser,Which magazine does Kwame Dawes serve as editor-in-chief?,Prairie Schooner,retain
Ted Kooser,What genre does Edward Hirsch primarily write in?,Poetry,retain
Ted Kooser,What position does Edward Hirsch hold at the John Simon Guggenheim Memorial Foundation?,President,retain
Ted Kooser,What is one of the major prizes a Copper Canyon Press poet won in 2020?,Jericho Brown won the 2020 Pulitzer Prize for Poetry for The Tradition,retain
Ted Kooser,What award did Kwame Dawes receive from Poets & Writers in 2011?,Barnes & Noble Writers for Writers Award,retain
Ted Kooser,When was Edward Hirsch born?,"January 20, 1950",retain
Ted Kooser,What magazine did Warren Woessner co-found in 1968?,Abraxas Magazine,retain
Ted Kooser,What professions is Kwame Dawes known for?,"Poet, actor, editor, critic, musician, and professor",retain
Ted Kooser,Can you name a bestseller by Edward Hirsch about reading poetry?,The document does not specify the title of the bestseller.,retain
Ted Kooser,What types of works does Copper Canyon Press specialize in publishing?,"Poetry, including new collections, translations, re-issues of classics, prose books about poetry, and anthologies",retain
Ted Kooser,What unique collection did Copper Canyon Press publish in 2016?,"Then Come Back: The Lost Neruda Poems, a collection of lost poems by Pablo Neruda",retain
Ted Kooser,What significant contribution did Greg Kuzma make in the 1970s?,"He founded the Best Cellar Press and the literary magazine, Pebble.",retain
Alfred Vogel,Who was Ben Black Elk's father?,Black Elk,retain
Alfred Vogel,In what book did Ben Black Elk serve as an interpreter for his father's interviews?,Black Elk Speaks,retain
Alfred Vogel,How many districts is Thurgau composed of?,5,retain
Alfred Vogel,In which part of Switzerland is Thurgau located?,Eastern Switzerland,retain
Alfred Vogel,Who acquired NRC Media group in 2015?,Mediahuis,retain
Alfred Vogel,What role is Ben Black Elk known as in relation to Mount Rushmore?,"the ""fifth face"" of Mount Rushmore",retain
Alfred Vogel,What are the names of the two newspapers that merged to form NRC Handelsblad?,Algemeen Handelsblad and Nieuwe Rotterdamsche Courant,retain
Alfred Vogel,Where was 'Zondag met Lubach' recorded?,In the main auditorium of the Theater Bellevue in Amsterdam.,retain
Alfred Vogel,What is 'Zondag met Lubach'?,A Dutch weekly satirical television programme.,retain
Alfred Vogel,Who presented 'Zondag met Lubach'?,Arjen Lubach.,retain
Alfred Vogel,What is the full former name of NRC?,NRC Handelsblad,retain
Alfred Vogel,What term is used to collectively refer to Appenzell Innerrhoden and Appenzell Ausserrhoden in political contexts?,beide Appenzell,retain
Alfred Vogel,What show succeeded 'Zondag met Lubach'?,De Avondshow met Arjen Lubach.,retain
Alfred Vogel,What significant event involving local peasants occurred in Thurgau in 1524?,"Local peasants occupied the cloister of Ittingen, driving out monks and destroying documents.",retain
Alfred Vogel,What is the district name where Feusisberg is situated?,Höfe District,retain
Alfred Vogel,When did 'Zondag met Lubach' first air and when did it end?,It aired between 2014 and 2021.,retain
Alfred Vogel,Who were the main scriptwriters for 'Zondag met Lubach'?,Tex de Wit and Pieter Jouke.,retain
Alfred Vogel,When was NRC Handelsblad first published?,1 October 1970,retain
Alfred Vogel,What led to the division of Appenzell into Innerrhoden and Ausserrhoden?,The Swiss Reformation,retain
Siegfried Lenz,During which world conflict was the Hansa utilized by Nazi Germany's Kriegsmarine?,World War II,retain
Siegfried Lenz,When did the meetings of Group 47 end?,1967,retain
Siegfried Lenz,What prestigious award did Martin Walser receive in 1981?,The Georg Büchner Prize,retain
Siegfried Lenz,How is a Fähnrich zur See formally addressed in the navy context?,Herr/Frau Fähnrich zur See,retain
Siegfried Lenz,What was the original purpose of the German auxiliary cruiser Hansa before it was converted?,It was originally conceived as the cargo ship Glengarry.,retain
Siegfried Lenz,What is the NATO rank group equivalent for Fähnrich zur See?,OR-6,retain
Siegfried Lenz,After how many months of service can an officer candidate be promoted to Fähnrich zur See in the Deutsche Marine?,21 months,retain
Siegfried Lenz,What was the fate of the Hansa after being de-commissioned as a Hilfskreuzer in February 1944?,The ship became a Kadettenschulschiff (cadet training ship).,retain
Siegfried Lenz,What was the main purpose of Group 47's meetings?,"Literary criticism and promotion of young, unknown authors.",retain
Siegfried Lenz,What significant role did Group 47 play in post-World War II Germany?,It offered a platform for the renewal of German literature after World War II and the end of censorship in Nazi Germany.,retain
Siegfried Lenz,How was the Treaty of Warsaw (1970) viewed by the conservative opposition in West Germany?,As a betrayal of national interests.,retain
Siegfried Lenz,"When did Dieter Hildebrandt die, and what was revealed just days before his death?","He died on 20 November 2013, and it was revealed just days before that he had cancer.",retain
Siegfried Lenz,Why was the Hansa not given a raider letter by the Royal Navy?,Because she did not enter active service as a commerce raider.,retain
Siegfried Lenz,What controversy did Martin Walser cause in his acceptance speech for the Peace Prize of the German Book Trade?,He criticised the 'monumentalization of shame' in remembrance of the Holocaust.,retain
Siegfried Lenz,What significant role did the Hansa serve from September 1944 to May 1945?,"Participated in the Baltic Sea evacuations, transporting over 12,000 soldiers and civilians.",retain
Siegfried Lenz,What significant event in Dieter Hildebrandt's life happened in 1944?,He was admitted to the Nazi Party on 20 April 1944.,retain
Siegfried Lenz,What did the Treaty of Warsaw (1970) commit both sides to?,Nonviolence and acceptance of the existing border—the Oder-Neisse line.,retain
Siegfried Lenz,Why was the Treaty of Warsaw significant from the Polish perspective?,"It was considered a compensation for the former Polish territory east of the Curzon Line, annexed by the Soviet Union in 1939.",retain
Siegfried Lenz,What countries were involved in the Treaty of Warsaw (1970)?,The Federal Republic of Germany (West Germany) and the People's Republic of Poland.,retain
Siegfried Lenz,What does 'Fähnrich zur See' designate in the German Navy?,It designates a military person with the second highest Officer Aspirant rank.,retain
"Philip Stanhope, 5th Earl Stanhope",What position succeeded the Secretary to the Board of Control after its abolition?,Under-Secretary of State for India,retain
"Philip Stanhope, 5th Earl Stanhope",What was the role of the Secretary to the Board of Control?,"Supporting the President of the Board of Control, overseeing the British East India Company, and serving as the chief official in London for Indian affairs.",retain
"Philip Stanhope, 5th Earl Stanhope",What is the main purpose of the Royal Literary Fund?,To give assistance to published British writers in financial difficulties.,retain
"Philip Stanhope, 5th Earl Stanhope","What was Robert Smith, 1st Baron Carrington's profession before he was raised to the peerage?","He was a banker, slave owner, and politician.",retain
"Philip Stanhope, 5th Earl Stanhope",How long did Robert Smith serve in the House of Commons?,From 1779 to 1797.,retain
"Philip Stanhope, 5th Earl Stanhope",What significant event inspired the founding of the Royal Literary Fund?,"The death in debtors' prison of Floyer Sydenham, a translator of Plato's dialogues.",retain
"Philip Stanhope, 5th Earl Stanhope",During which years did the post of Secretary to the Board of Control have Joint Secretaries?,Part of 1834 and from 1835,retain
"Philip Stanhope, 5th Earl Stanhope","Who were Robert Smith, 1st Baron Carrington's parents?","Abel Smith (1717–1788) and Mary (née Bird, 1724–1780).",retain
"Philip Stanhope, 5th Earl Stanhope",Who was the first Secretary to the Board of Control?,Charles William Rouse-Boughton,retain
"Philip Stanhope, 5th Earl Stanhope",How does the Royal Literary Fund generate its current funds?,"Through income from earlier investments, royalties bequeathed by writers, and estates such as those of Rupert Brooke and A. A. Milne.",retain
"Philip Stanhope, 5th Earl Stanhope",Can you name some of the established writers the Royal Literary Fund has helped?,"Samuel Taylor Coleridge, James Joyce, and Joseph Conrad among others.",retain
"Philip Stanhope, 5th Earl Stanhope",When was the position of Secretary to the Board of Control abolished?,1858,retain
"Philip Stanhope, 5th Earl Stanhope",Who held the position of Secretary to the Board of Control just before it was abolished?,Henry Baillie,retain
"Philip Stanhope, 5th Earl Stanhope",When was the Royal Literary Fund founded?,1790,retain
"Philip Stanhope, 5th Earl Stanhope",What year was the Royal Literary Fund granted a royal charter?,1818,retain
"Philip Stanhope, 5th Earl Stanhope","When was Robert Smith, 1st Baron Carrington, born?",22 January 1752,retain
"Philip Stanhope, 5th Earl Stanhope","When and whom did Robert Smith, 1st Baron Carrington, marry as his first wife?",Anne Boldero-Barnard on 6 July 1780.,retain
Bruce Graham,What is the official name of the John Hancock Center as of 2018?,875 North Michigan Avenue,retain
Bruce Graham,"How tall is the John Hancock Center, including its antenna masts?","1,500 feet",retain
Bruce Graham,What was the original name of Willis Tower?,Sears Tower,retain
Bruce Graham,When did the Hotel Arts in Barcelona first open?,1992,retain
Bruce Graham,What is the University of Pennsylvania commonly known as?,Penn or UPenn,retain
Bruce Graham,What is the official name of Peru?,Republic of Peru,retain
Bruce Graham,When did Peru formally proclaim its independence from Spain?,1821,retain
Bruce Graham,How many departments is Colombia divided into?,32 departments.,retain
Bruce Graham,What is the official language of Colombia?,Spanish.,retain
Bruce Graham,What was the original site of the Broadgate development?,The original site of Broadgate development was Broad Street station.,retain
Bruce Graham,What are the main bodies of water bordering Colombia?,The Caribbean Sea to the north and the Pacific Ocean to the west.,retain
Bruce Graham,Where is Canary Wharf located?,"Canary Wharf is located in London, England, near the Isle of Dogs in the London Borough of Tower Hamlets.",retain
Bruce Graham,What significant first does the University of Pennsylvania's Wharton School hold?,It is the nation's first collegiate business school.,retain
Bruce Graham,What is the population of London?,Around 8.8 million.,retain
Bruce Graham,How tall is Willis Tower?,"1,451 feet (442.3 m)",retain
Bruce Graham,What is Canary Wharf known for?,"Canary Wharf is known for being one of the main financial centres in the United Kingdom and the world, containing many high-rise buildings including One Canada Square.",retain
